{
  "$schema": "http://json-schema.org/draft-07/schema#",
  "title": "Celestial Body Taxonomy",
  "description": "Taxonomy schema for classifying celestial bodies in the Solar System. Defines categories matching the frontend body types and ML model labels.",
  "type": "array",
  "items": {
    "type": "object",
    "title": "Celestial Body Entry",
    "description": "A single celestial body entry with its taxonomic classification and physical metadata.",
    "properties": {
      "category": {
        "type": "string",
        "enum": ["Star", "Planet", "DwarfPlanet", "Asteroid", "Comet", "Interstellar", "Moon", "Spacecraft"],
        "description": "Top-level classification matching the frontend BodyType and ML model labels."
      },
      "sub_category": {
        "type": "string",
        "minLength": 1,
        "description": "Sub-classification within the top-level category (e.g., 'Terrestrial', 'Gas Giant', 'Ice Giant', 'Kuiper Belt Object', 'Main Belt', 'NEA', 'Trojan', 'Rover', 'Orbiter', 'Telescope', 'Lander')."
      },
      "name": {
        "type": "string",
        "minLength": 1,
        "description": "Official IAU name or mission name of the celestial body."
      },
      "mass_kg": {
        "type": "number",
        "minimum": 0,
        "description": "Mass of the celestial body in kilograms. Zero when unknown or not applicable."
      },
      "orbital_period_days": {
        "type": "number",
        "minimum": 0,
        "description": "Orbital period around the primary body in Earth days. Zero for the Sun, escaped spacecraft, or interstellar passers-through."
      },
      "composition_type": {
        "type": "string",
        "enum": ["silicate", "ice", "gas", "plasma", "metal"],
        "description": "Primary bulk composition type. 'silicate' for rocky bodies, 'ice' for icy bodies, 'gas' for gas-dominated bodies, 'plasma' for stars, 'metal' for metallic bodies."
      }
    },
    "required": [
      "category",
      "sub_category",
      "name",
      "mass_kg",
      "orbital_period_days",
      "composition_type"
    ],
    "additionalProperties": false
  }
}
